{
  "id": "shms-pal-ai-hanzala-2025",
  "title": "بالصور «حنظلة».. مشروع PAL AI يطلق نموذجًا لغويًا بهوية فلسطينية خالصة لمواجهة تزوير السردية",
  "publisher": "وكالة شمس نيوز الإخبارية",
  "url": "https://shms.ps/post/206827/%D8%AD%D9%86%D8%B8%D9%84%D8%A9-%D9%85%D8%B4%D8%B1%D9%88%D8%B9-PAL-AI-%D9%8A%D8%B7%D9%84%D9%82-%D9%86%D9%85%D9%88%D8%B0%D8%AC-%D8%A7-%D9%84%D8%BA%D9%88%D9%8A-%D8%A7-%D8%A8%D9%87%D9%88%D9%8A%D8%A9-%D9%81%D9%84%D8%B3%D8%B7%D9%8A%D9%86%D9%8A%D8%A9-%D8%AE%D8%A7%D9%84%D8%B5%D8%A9-%D9%84%D9%85%D9%88%D8%A7%D8%AC%D9%87%D8%A9-%D8%AA%D8%B2%D9%88%D9%8A%D8%B1-%D8%A7%D9%84%D8%B3%D8%B1%D8%AF%D9%8A%D8%A9",
  "published_at": "2025-12-15",
  "accessed_at": "2026-09-02T00:00:00Z",
  "source_type": "media-report",
  "schema_type": "NewsArticle",
  "language": "ar",
  "reliability": "secondary"
}
