{
  "id": "shabab-fm-pal-ai-interview-2025",
  "title": "حنظلة: أول مشروع ذكاء اصطناعي فلسطيني لحماية الرواية والهوية — الصحفي عبد الرحمن أبو عساكر",
  "publisher": "Shabab FM شباب اف ام",
  "url": "https://www.youtube.com/watch?v=JpiDVtyyi3M",
  "published_at": "2025-12-18",
  "accessed_at": "2026-09-02T00:00:00Z",
  "source_type": "interview",
  "schema_type": "VideoObject",
  "language": "ar",
  "reliability": "primary"
}
